Product Name,Description,Recent Launches,Reviews,ProductHuntURL,ProductURL,その他,初期顧客,ペルソナ,市場規模
Screen Studio,Screen Studioは、美しいスクリーン録画を数分で作成できるツールです。使い方は簡単で、アプリを起動して録画したい画面を選択し、録画ボタンを押すだけ。録画中、マウスの動きが滑らかに表示され、クリックの際には自動でズームインし、すべてのアニメーションにシネマティックなモーションブラーが適用されます。さらに、録画に美しい背景を追加することで、素早く高品質なプロモーションビデオを作成できます。,最近の製品発表：Screen Studioが発表されました。このツールは、マウスの動きを滑らかにし、クリックの際に自動的にズームインします。また、すべてのアニメーションにシネマティックなモーションブラーを適用し、録画の周囲に美しい背景を追加します。これにより、1分以内で録画が高品質なプロモーションビデオに変わります。2年前に発表されました。,,https://www.producthunt.com/products/screen-studio,https://screen.studio?ref=producthunt,Screen Studioは、CamtasiaやOBS Studioなどの競合製品と比較すると、簡単な操作と迅速な出力が特徴です。また、ユースケースとしては、オンライン講座の作成や製品デモの録画などが挙げられます。技術的には、スムーズなマウス動作や自動ズーム機能が優れていますが、より多彩な編集機能があれば改善の余地があります。,マーケティングチームや教育者,スクリーン録画を使ってプロモーションや教育に活用したい人たち,オンライン教育市場やデジタルコンテンツ制作市場は急成長しており、関連ツールの需要が高まっています。
Fairmint - Equity of the Future,Fairmintは、コミュニティと会社の成功を共有できるプラットフォームです。このサービスを利用することで、自社に価値をもたらす人々に株式を付与し、あなたのビジネスのファンからの投資を受け取ることができます。使い方は簡単で、数回のクリックで立ち上げることができ、その後はビジネスの構築に集中できます。,最近のローンチとして、Fairmintはコミュニティメンバーに対して株式を与えることを可能にしました。このサービスは、あなたの会社に価値を追加する人々にエクイティを提供し、彼らからの投資を受け取る仕組みを提供します。立ち上げは簡単で、ビジネスの成長に専念できる環境を作ることができます。,,https://www.producthunt.com/products/fairmint-equity-of-the-future,https://www.fairmint.com?ref=producthunt,他の類似サービス（例: WefunderやSeedInvest）と比較して、Fairmintはコミュニティのメンバーに対してより多様なエクイティオプションを提供します。具体的なユースケースとしては、スタートアップが早期にコミュニティを巻き込み、持続的な支援を受けることが挙げられます。技術的には、ユーザーフレンドリーなインターフェースと高い透明性が利点です。改善の余地として、さらに多様な投資オプションや複雑な資金調達戦略への対応が考えられます。,スタートアップや中小企業,資金調達をしたいが、従来の経路に頼らない企業,新興企業の資金調達市場は急速に成長しており、特にエクイティファイナンスへの需要が高まっています。
ThreadStart,ThreadStartは、豊富な編集機能を備えたTwitterスレッド作成・スケジューリングツールです。ユーザーは直感的な方法で、画像を追加し、テキストのフォーマットを調整することが簡単にできます。リアルタイムでスレッドのプレビューが表示されるため、投稿前にコンテンツを確認することができ、効率的に作業を進められます。このツールを使うことで、時間を節約しながらフォロワーを増やすことが可能です。,ThreadStartは、Twitterスレッドを簡単に作成・スケジュール・公開するためのツールです。その豊富なエディタにより、画像の追加やテキストのフォーマットが簡単に行えます。また、スレッドのプレビューはリアルタイムで更新され、ユーザーは常に最終的な内容を確認しながら作業を進めることができます。これにより、時間を節約し、効果的にフォロワーを増やせるでしょう。登場から3年が経過し、多くのユーザーに利用されています。,,https://www.producthunt.com/products/threadstart,https://threadstart.io?ref=producthunt,ThreadStartは、他の類似製品と比較して、直感的なユーザーインターフェイスと充実したフォーマット機能を提供します。具体的なユースケースとして、企業の最新情報をまとめたスレッド作成が考えられます。技術的利点としては、リアルタイムプレビュー機能が挙げられますが、さらなる機能追加やモバイル対応の改善が必要です。,ソーシャルメディアを活用するマーケティング担当者や個人ブロガー,Twitterでの影響力を高めたいと考えるユーザーや企業,デジタルマーケティングおよびソーシャルメディア管理ツール全般の市場規模は急成長しており、数百億円に達する可能性がある
Superblocks,Superblocksを使用すると、内部アプリケーション、ワークフロー、ジョブを構築するのに数百時間を節約できます。このプラットフォームは、データベースやAPIに接続したアプリを迅速に開発できる機能を提供します。使い方は簡単で、直感的なUIを使って新しいアプリやワークフローを作成し、セキュリティやアクセス管理も細かく設定できます。また、GitOpsを利用してデプロイし、運用状況をモニタリングすることも可能です。,最近のリリースでは、Superblocksが登場しました。このツールを使用すると、データベースやAPIに接続された内部アプリ、ワークフロー、スケジュールされたジョブを迅速に構築できます。セキュリティ面では、詳細な権限管理（RBAC）、SSO（シングルサインオン）、監査ログ、シークレット管理といった機能を数秒で設定することができます。また、GitOpsを利用してデプロイし、製品環境をモニタリングしながら、コードでさまざまな機能を拡張することができます。,,https://www.producthunt.com/products/superblocks,https://www.superblocks.com/?utm_campaign=producthunt-app&utm_source=producthunt&utm_medium=social&ref=producthunt,Superblocksは、OutSystemsやMendixなどの類似製品と比較して、より柔軟なコード拡張性を提供します。ユースケースとしては、業務プロセスの自動化やデータ管理の効率化が挙げられます。技術的には、RBACやSSOのサポートが強みですが、改善の余地としては、ユーザーインターフェースのさらなる直感化が考えられます。,中小企業やスタートアップなど、迅速に内部アプリを構築したい組織。,技術者、プロジェクトマネージャー、オペレーション担当者。,500億円以上の産業で、特にデジタルトランスフォーメーションを推進する企業に広がりがある。
Jimo,Jimoは、ユーザーを賢く onboard し、迅速にスケールするためのツールです。製品チームとそのユーザーの間に新たなインタラクションレイヤーを提供し、エンジニアリングなしでコンテキストに基づいた製品内のインタラクションを作成できます。これにより、ユーザー教育、製品ツアー、ツールチップ、アンケートを通じて、ユーザーが製品を効率的に理解し活用できるようになります。,最近のリリースには、Jimo 1.0があり、これは製品チームがユーザーと効果的に接続できる新しいインタラクションレイヤーです。製品ライフサイクルのあらゆるステップにおいて、発見や発展から機能の発表まで、ユーザー中心の製品を構築するための手助けをします。1年前にリリースされたこのバージョンは、技術的な知識がなくても利用できる機能を提供します。,,https://www.producthunt.com/products/jimo,https://www.usejimo.com?ref=producthunt,Jimoは、他の類似製品（例えば、IntercomやPendo）と比較して、エンジニアリングなしで簡単に実装できる点が強みです。また、具体的なユースケースとしては、オンボーディングプロセスの改善やユーザーのフィードバック収集が挙げられます。技術的には、簡単なドラッグ＆ドロップインターフェースを提供し、改善の余地としてさらなるカスタマイズオプションの追加が考えられます。,プロダクトチーム、UXデザイナー、スタートアップ企業,製品のユーザー体験を最適化したいプロダクトマネージャーやマーケティング担当者,ユーザーエンゲージメントツール市場は今後数年で拡大傾向にあり、特にデジタルプロダクトの普及に伴い大きな成長が期待される
Summari,Summariは、長文記事を瞬時に要約するアプリです。ユーザーは文章を入力することで、要点を箇条書きで得ることができます。これにより、コンテンツをより効果的にフィルタリングし、時間を節約することが可能になります。使い方は簡単で、長文をコピー＆ペーストするだけで、それらを短くまとめた要約が得られます。,最近のローンチ情報として、Summariはウェブとモバイルアプリケーションとして発表されました。このアプリは、2時間の映画を予告編でプレビューするように、長文を瞬時に把握できるように設計されています。私たちは、テキストの要約をシンプルかつ迅速に行うことができます。これは3年前の発売時に登場しました。,,https://www.producthunt.com/products/summari,https://www.summari.com/?utm_source=producthunt&utm_campaign=ph1&ref=producthunt,類似製品には、リーディングアプリやAIベースの要約ツールがありますが、Summariは特にユーザーフレンドリーなインターフェースに優れています。具体的なユースケースとしては、学術論文の要約やニュース記事の迅速なレビューが考えられます。技術的には、自然言語処理を活用しており、さらなる改善点としては言語の多様性や要約の精度向上があげられます。,忙しいプロフェッショナルや学生,情報を効率よく処理したいが、時間がない人々,情報処理関連の市場は成長中で、ますます多くの人が要約ツールを必要としています。
Fig,Figは、ターミナルを再構築した新しいツールです。開発者はFigを使って、Jupyter Notebookスタイルのインターフェイスでスクリプトを作成できます。コード、入力、マークダウンを組み合わせ、ユーザー入力を美しいターミナルUIライブラリを利用してキャプチャできます。チームメンバーとスクリプトやCLIを即座に共有することが可能です。,最近のリリースには、FigスクリプトとManual Pagesがあります。Figスクリプトでは、Jupyter Notebookスタイルのインターフェイスを使用してコードやマークダウンを記述し、魅力的なターミナルUIライブラリを介してユーザー入力を受け取ることができます。また、Manual Pages（fig.io/manual）では、300以上のCLIツールのための美しいオンラインドキュメントを提供しており、すべての説明はコミュニティ主導でオープンソースの形で貢献が可能です。,,https://www.producthunt.com/products/fig,,Figは、他のCLIツールやスクリプト言語と比較して、美しいUIとユーザーインタラクションを提供する点で優れています。ユースケースとしては、チーム内でのスクリプトの共同作成やドキュメンテーションが挙げられ、技術的な利点は、オープンソースコミュニティによる迅速な改善と拡張性です。今後の改善の余地としては、ユーザーフィードバックに基づくUIの向上やさらなるCLIツールの追加が考えられます。,開発者、データサイエンティスト,CLIツールを頻繁に使用する技術者,大規模なソフトウェア開発市場
HeyGen,HeyGenは、カメラやクルーなしで、写真や動画をリアルなアバターに変換することができます。最先端のAIビデオ技術を利用して、リップシンクの精度が卓越しており、175以上の言語に翻訳可能です。使用方法は簡単で、撮影のためのリシュートは不要で、持ち運びが可能なデバイスでどこでも利用できます。,最近のローンチでは、HeyGenのiOSモバイルアプリが発表され、写真や動画を非常にリアルなアバターに変換する機能が搭載されています。また、HeyGenのインタラクティブアバターはZoomミーティングに参加し、24時間365日複数の会議を処理する能力があります。これにより、あなたの外見や声を模倣し、リアルタイムで意思決定を行うことができ、コーチング、サポート、営業コールに最適です。,,https://www.producthunt.com/products/heygen,https://www.heygen.com?ref=producthunt,HeyGenは、似たような製品と比較して圧倒的なリップシンク技術を持っており、ユースケースとしてはウェビナーやリモートコーチングに適しています。技術的には、ユーザーがリアルタイムでインタラクティブな体験を実現するための利点がありますが、さらなる改善としてユーザーインターフェースの直感性向上が求められます。,クリエイター、ビジネスプロフェッショナル,オンラインコンテンツクリエイターやリモートワーカー,拡大中のAI及びビデオ制作市場
Howitzer for Reddit,Howitzer for Redditは、世界初のRedditマーケティング自動化ツールです。これにより、Redditを活用して直接的なアプローチが可能となり、大規模にパーソナライズされたメッセージを送信できます。このツールは、従来のマーケティングチャネルとは異なる高いレスポンス率を実現します。使い方としては、対象とするRedditコミュニティを選び、その中で見込み客に向けたメッセージを自動的に生成・送信することで、効率的に新しい顧客を獲得できます。,最近のローンチ情報：Howitzer for Redditは新しい顧客をReddit上で見つけ、大規模にパーソナライズされたメッセージを送ることができるツールです。Redditを通じた直接的なアプローチをサポートし、他のマーケティングチャネルとは異なる優れたレスポンス率を提供します。このツールは3年前にチームによって開発されました。,,https://www.producthunt.com/products/howitzer-for-reddit,,この製品は、従来の広告手法と比べて費用対効果が高く、特定のニッチな市場をターゲットにするのに適しています。具体的なユースケースとしては、新製品の発表時にターゲットユーザーにダイレクトメッセージを送ることが考えられます。技術的には、Reddit APIを活用してメッセージ送信を自動化することが可能ですが、ユーザーのセキュリティやプライバシーへの配慮が必要です。改善の余地としては、ユーザーインターフェースの直感的な操作感の向上が挙げられます。,中小企業のマーケティング担当者やスタートアップ,Redditを利用したいが、効果的なアプローチ方法がわからないマーケティング担当者,Redditのユーザー数は増加しており、特に若年層を中心に強い影響力を持っています。
erxes Inc,erxes Incは、利用可能な経験管理インフラを提供します。このプラットフォームを使用することで、企業は顧客との関係を深め、コミュニケーションを効率化することができます。例えば、顧客のフィードバックを集めたり、プロジェクト管理を行ったりする際に役立ちます。使い方は簡単で、必要な機能を選択して導入するだけで、すぐに業務に活用することができます。,最近の製品発表には、erxes Business Messenger v2.0があります。この強力なツールは、顧客とのエンゲージメントを高め、コミュニケーションチャネルを合理化するために設計されており、わずか11ドルで提供されています。また、Experience Management (XM) Bundlesも発表されており、成功するSaaSビジネスのために、販売サイクル、従業員管理、フロントライン業務を効率化するための基本的なツールが個別のバンドルにまとめられています。これにより、ビジネスのさまざまな経験に焦点を当てた成長を促進することができます。,,https://www.producthunt.com/products/erxes,http://erxes.io?ref=producthunt,erxes Incは顧客体験を重視した運営方法を提供しています。競合製品に対して、特に価格競争力が高く、機能が充実している点が強みです。しかし、ユーザーインターフェイスの改善や、さらなる機能追加が求められています。また、具体的なユースケースとしては、カスタマーサポートの効率化や、社内コミュニケーションの活性化などがあります。,中小企業やスタートアップ企業,経営者やプロジェクトマネージャー,世界中のSaaS市場は急速に拡大しており、予測では数百億ドルに達する見込み
SigmaOS Browser,SigmaOSブラウザーは、インターネットのための新しいホームです。ユーザーの好奇心を満たす全く新しい方法を提供します。使い方としては、どんな質問、アイデア、考えについても調べることができ、特定のウェブサイトに関して疑問を投げかけることが可能です。また、ページのインタラクティブな要約を作成するために、ピンチ操作を使うことができます。,最近のリリースには、SigmaOS Airis（アルファ）が含まれます。Airisは、インターネット上での好奇心を満たす全く新しい方法を提供します。質問を調べるための魅力的な出発点を得たり、どんなウェブサイトについても何でも質問できたり、ページのインタラクティブな要約を作成することができます。また、SigmaOS 1.0では、ウェブ作業を効率的に行うための機能が搭載されています。タブをToDoリストのように整理できるワークスペース、2ページを同時に作業できるスプリットスクリーン、チームメンバーや友人と共同でブラウジングできるマルチプレイヤー機能があります。,レビューは現在ありません。,https://www.producthunt.com/products/sigmaos,https://sigmaos.com?ref=producthunt,SigmaOSブラウザーは、FirefoxやChromeと比較しても、特に作業効率を重視した機能が特徴です。具体的なユースケースとしては、リモートチームによる共同作業や、学習目的の調査における活用が考えられます。技術的には、マルチタスクを可能にする設計が優れており、改善の余地としてはさらなるカスタマイズ機能や拡張機能の追加が期待されます。,技術に関心がある若年層やプロフェッショナル,効率的な作業を求めるユーザーやチームでのコラボレーションを重視する制作スタッフ,ブラウザ市場は非常に大きく、数十億ドル規模の成長が見込まれている
FUNCTION12,FUNCTION12は、コードを迅速に取得できるデザインからコードへの自動化ツールです。デザインファイルをプロダクション準備が整ったコードに変換することができます。使い方は非常に簡単で、デザインファイルをコピーして貼り付けるだけで高品質なコードを生成します。これにより、冗長な手作業コーディングにかかる時間を大幅に削減できるため、プロフェッショナルな開発者にとって非常に便利です。,最近のリリース情報として、FUNCTION12はプロフェッショナル向けのデザインからコードへと自動化するツールです。このツールを利用することで、冗長なハンドコーディングにかかる時間を削減し、デザインファイルをすぐにプロダクション向けのコードに変換できます。FUNCTION12を活用することで、あなたの生産を加速させましょう。,,https://www.producthunt.com/products/function12,,FUNCTION12は競合他社のツールに比べて操作が簡単で、迅速なレスポンスを提供します。ユースケースとしては、Webサイトやアプリケーションのデザインを迅速に展開する場面で特に効果的です。技術的利点としては、コードの品質が高く、メンテナンスが容易です。改善の余地としては、さらに多くのデザインファイル形式に対応する必要があります。,デザインとコーディングの効率を求めるプロフェッショナル開発者,ソフトウェアエンジニア、UX/UIデザイナー、プロジェクトマネージャー,デザイン自動化ツール市場は急成長中で、数十億ドル規模
Guidde,Guiddeを使用することで、AIの魔法の力で動画ドキュメントを簡単に作成できます。このツールは、サポートチケット、ナレッジベースの記事、顧客とのコミュニケーション、新機能の発表、内部のナレッジキャプチャに最適です。使用方法は非常に簡単で、数秒以内にハウツー動画を作成し、チームや顧客と手軽に共有することができます。,最近のリリースにはGuidde AIがあり、これはチームがナレッジを11倍早く提供できるようにする生成AIプラットフォームです。1年前にリリースされたGuiddeは、数秒でハウツー動画を作成し、顧客やチームと簡単に共有することができます。これは、サポートチケットやナレッジベースの記事、顧客とのコミュニケーションに非常に適しており、無料でお試しいただけます：guidde.com（2年前にリリース）。,,https://www.producthunt.com/products/guidde-2,http://guidde.com?ref=producthunt,Guiddeは他の動画作成ツールと比較しても、特にAIによる自動化が優れており、簡単に利用できる点が強みです。具体的なユースケースとしては、社内研修や顧客への製品説明が考えられます。技術的には、生成AIを活用しており、高速かつ効率的なコンテンツ制作が実現されています。ただし、さらなる機能展開やインテグレーションの改善が期待されます。,企業のカスタマーサポートチームや教育機関,新機能の紹介やユーザートレーニングを行う必要があるプロフェッショナル,動画コンテンツ作成ツール市場は急成長しており、特に企業向けに需要が高まっている
