Product Name,Description,Recent Launches,Reviews,ProductHuntURL,ProductURL,その他,初期顧客,ペルソナ,市場規模
timeOS,timeOSは、カレンダーを超えた新しい時間管理の方法を提供します。このツールは、会議やタスクをより効率的に整理し、重要な情報にアクセスする手助けをします。使用方法としては、まずカレンダーに入力されたイベントや会議を一目で確認し、関連する情報を瞬時に把握することができます。また、AIがあなたの会議のノートを整理し、次のステップを提示する機能も備わっています。,最近のローンチとしては、Magic Notepad by timeOSがあります。この機能は、あなたの会議ノートに人間らしさを取り戻すもので、重要な内容をメモすると、AIが生のノートと会議の議事録を整理して、構造化された洞察、美しいフォーマット、次のアクションを提案してくれます。また、timeOS 2.0は、新しいタブページをAIで強化し、次の会議の準備を助ける機能を提供しています。イベントにホバーすることで、Gmailの関連コンテキストや過去の会議ノート、LinkedInからの情報にアクセス可能です。会議のリマインダーから直接AIと対話することで、数秒で準備が整います。,レビューは現在ありません。,https://www.producthunt.com/products/timeos,https://www.timeos.ai?ref=producthunt,timeOSは、他の市販の時間管理ツールと比較して、AIによる整理機能が特に優れています。具体的なユースケースとしては、リモートワークの環境下での会議の効率化があります。技術的には、自然言語処理を用いたノートの分析能力がありますが、ユーザーインターフェースのさらなる改善の余地があります。,プロフェッショナルなビジネスマンや女性、会議を多く持つ企業。,時間管理を求める忙しいビジネスパーソン。,時間管理アプリや生産性向上ツールの市場は、数十億ドル規模に達する可能性を秘めています。
Sidekick Browser,Sidekick Browserは、仕事のために作られた最速のブラウザです。このブラウザは、ユーザーがオンラインでの気を散らす要素から保護されるよう設計されています。特にADHDを持つ人々や、仕事でインターネットを多く利用するプロフェッショナルに最適です。使用方法は非常にシンプルで、必要なウェブアプリケーションをまとめて管理し、作業に集中できる環境を提供します。,"最近のリリース情報: 
- Sidekick Browser 3.0: このバージョンはブラウジングのスタイルを変革し、オンラインでの気を散らす要素からユーザーを守ります。ADHDを持つ人々のために開発されており、作業に集中するための優れたツールが豊富に用意されています。リリースは2年前です。
- Sidekick Browser 2.0: 知識労働者のための生産性ブラウザで、デフォルトで超高速かつ安全です。すべてのウェブアプリを統合し、組織的に作業を進めることができ、ワークフローを加速させます。こちらも2年前のリリースです。",,https://www.producthunt.com/products/sidekick-browser,https://meetsidekick.com?ref=producthunt,Sidekick Browserは、他の生産性やフィルタリング機能を持つブラウザと比較して、特にADHDユーザーに特化している点が大きな特徴です。具体的なユースケースとしては、集中して作業を行いたいときに効果的です。技術的には、人気のあるウェブアプリを統合できる点が強みですが、ユーザーインターフェースの改善余地があります。,ADHDを持つプロフェッショナルや生産性を重視する知識労働者,仕事において気が散りやすい環境で作業をする必要があるユーザー,生産性ツール市場は年々成長しており、特にリモートワークの普及に伴って拡大しています。
Limitless,Limitlessは、あなたの思考の限界を超えるための革新的なツールです。このアプリを使用することで、実世界の会話を保存し、パーソナライズされたAIに何でも尋ねることができます。主な使い方としては、会議の準備をサポートし、自動的にメモを取り、要約を作成することで、会議を楽しくし、効率的に進行できます。,最近の製品ローンチには、Limitlessがあります。これは、ウェブアプリ、Macアプリ、Windowsアプリ、さらにウェアラブルデバイスとして利用できるフル機能のアプリです。会議の準備や議事録の自動作成を通じて、より効果的なコミュニケーションを実現します。また、Rewind for iPhoneもあり、これは完全にパーソナライズされたAIであり、あなたのiPhone上で見たものについてブラウジングや検索が可能です。,,https://www.producthunt.com/products/rewind-2,https://www.limitless.ai?ref=producthunt,Limitlessは、同様の機能を持つ他のアプリと比較して独自の会話保存機能を持っている点が特徴です。また、具体的にはリモートワークやハイブリッドワーク環境における会議の効率化を図るユースケースが想定されます。技術的には高性能な自然言語処理を活用しており、今後の改良点としては、さらに多言語対応を進めることが考えられます。,ビジネスプロフェッショナルや会議を頻繁に行う人々。,効率を重視し、コミュニケーションを改善したいと考えている中堅から上級のビジネスパーソン。,ビジネスコミュニケーションおよびAIツール市場は急成長しており、数百億円規模に達する見込み。
Startup Recipes,Startup Recipesは、60以上のスタートアップ公式が含まれた、究極のMVPチートシートです。アイデア段階の起業家が効果的にプロダクト・マーケット・フィットを見つけるために、最小限の実行可能製品(MVP)を正しく構築する手助けをします。このツールを使うことで、起業家は迅速にアイデアを具体化し、実践的なステップに進むことが可能です。たとえば、ビジネスモデルを検証し、顧客のフィードバックを得る際に非常に役立ちます。これにより、無駄な時間やコストを省き、効率的な製品開発が実現します。,最近のローンチ情報では、Startup Recipesが3年前にローンチされました。この製品は、リーンスタートアップを学ぶことが容易である一方で、それを実際のビジネスに適用することが難しい起業家に最適なチートシートです。Startup Recipesは、アイデア段階の起業家が迅速に適切な製品を開発し、マーケットでのフィットを見つけるための強力なツールとして位置付けられています。,,https://www.producthunt.com/products/startup-recipes,https://productrecipes.com?ref=producthunt,Startup Recipesは、類似製品であるLeanstackやBusiness Model Canvasと比較して、より具体的なステップバイステップのガイドを提供します。具体的なユースケースには、初期段階での顧客開発やプロダクトテストがあり、技術的には、簡潔で実践的なアプローチが強みです。しかし、ユーザーインターフェースの改善や、他のツールとの統合の余地があると考えられます。,アイデア段階の起業家やスタートアップの創業者,新しいビジネスを立ち上げたいが、具体的な方法に困っている人々,小規模企業の創業支援市場は年々拡大しており、世界中で数百億ドル規模と推定される
